<?xml version="1.0" encoding="utf-8"?>
<PlayStationGame xmlns:xsi="http://www.w3.org/2001/XMLSchema-instance" xsi:noNamespaceSchemaLocation="../PlayStationGame.xsd">
  <Game>
    <Id>NPWR03160_00</Id>
    <IdEurope></IdEurope>
    <Title>Pinball Arcade</Title>
    <Image>http://trophy01.np.community.playstation.net/trophy/np/NPWR03160_00_14688FF02E3D5F775783097C716EE6A054A713FE/65225787556359B208075023B766A60D9381B5E9.PNG</Image>
    <TrophiesCount Total="12" Bronze="4" Silver="8" Gold="0" Platinum="0" />
    <TotalPoints>300</TotalPoints>
    <Platform>?</Platform>
  </Game>
  <Trophies>
    <Trophy>
      <Id>1</Id>
      <GameId>NPWR03160_00</GameId>
      <Title>Tales High 5</Title>
      <Image>http://trophy01.np.community.playstation.net/trophy/np/NPWR03160_00_14688FF02E3D5F775783097C716EE6A054A713FE/CF1C92916F979D0B3315C7747BFB1A373272233C.PNG</Image>
      <Description>Achieve a top 5 local high score on Tales of the Arabian Nights®</Description>
      <Type>BRONZE</Type>
      <Hidden>true</Hidden>
    </Trophy>
    <Trophy>
      <Id>2</Id>
      <GameId>NPWR03160_00</GameId>
      <Title>Tales Master</Title>
      <Image>http://trophy01.np.community.playstation.net/trophy/np/NPWR03160_00_14688FF02E3D5F775783097C716EE6A054A713FE/82CE689414986B3CE7F0B6CE2C57CF7F61427B67.PNG</Image>
      <Description>Complete the Standard Goals on Tales of the Arabian Nights®</Description>
      <Type>SILVER</Type>
      <Hidden>true</Hidden>
    </Trophy>
    <Trophy>
      <Id>3</Id>
      <GameId>NPWR03160_00</GameId>
      <Title>Tales Wizard</Title>
      <Image>http://trophy01.np.community.playstation.net/trophy/np/NPWR03160_00_14688FF02E3D5F775783097C716EE6A054A713FE/333AF35AFFC24CBA8DF3FAE1B8A3DABB7DE0A530.PNG</Image>
      <Description>Complete the Wizard Goals on Tales of the Arabian Nights®</Description>
      <Type>SILVER</Type>
      <Hidden>true</Hidden>
    </Trophy>
    <Trophy>
      <Id>4</Id>
      <GameId>NPWR03160_00</GameId>
      <Title>Ripley's High 5</Title>
      <Image>http://trophy01.np.community.playstation.net/trophy/np/NPWR03160_00_14688FF02E3D5F775783097C716EE6A054A713FE/F51869E89576AB87040B8C32387867C655F9D391.PNG</Image>
      <Description>Achieve a top 5 local high score on Ripley’s Believe it or Not!®</Description>
      <Type>BRONZE</Type>
      <Hidden>true</Hidden>
    </Trophy>
    <Trophy>
      <Id>5</Id>
      <GameId>NPWR03160_00</GameId>
      <Title>Ripley's Master</Title>
      <Image>http://trophy01.np.community.playstation.net/trophy/np/NPWR03160_00_14688FF02E3D5F775783097C716EE6A054A713FE/6CB11B87A46BD1D9C5CD6EAA6DE4F31735DAE7EB.PNG</Image>
      <Description>Complete the Standard Goals on Ripley’s Believe it or Not!®</Description>
      <Type>SILVER</Type>
      <Hidden>true</Hidden>
    </Trophy>
    <Trophy>
      <Id>6</Id>
      <GameId>NPWR03160_00</GameId>
      <Title>Ripley's Wizard</Title>
      <Image>http://trophy01.np.community.playstation.net/trophy/np/NPWR03160_00_14688FF02E3D5F775783097C716EE6A054A713FE/E34868261B83259C5FDDE6AA4487C4BF76BA5C27.PNG</Image>
      <Description>Complete the Wizard Goals on Ripley’s Believe it or Not!®</Description>
      <Type>SILVER</Type>
      <Hidden>true</Hidden>
    </Trophy>
    <Trophy>
      <Id>7</Id>
      <GameId>NPWR03160_00</GameId>
      <Title>Theatre High 5</Title>
      <Image>http://trophy01.np.community.playstation.net/trophy/np/NPWR03160_00_14688FF02E3D5F775783097C716EE6A054A713FE/481E1490808CCBA88C8B6990886DEFC28BA17AC1.PNG</Image>
      <Description>Achieve a top 5 local high score on Theatre of Magic®</Description>
      <Type>BRONZE</Type>
      <Hidden>true</Hidden>
    </Trophy>
    <Trophy>
      <Id>8</Id>
      <GameId>NPWR03160_00</GameId>
      <Title>Theatre Master</Title>
      <Image>http://trophy01.np.community.playstation.net/trophy/np/NPWR03160_00_14688FF02E3D5F775783097C716EE6A054A713FE/033D95054122C6A2B93B5ECD08FA6970770DD845.PNG</Image>
      <Description>Complete the Standard Goals on Theatre of Magic®</Description>
      <Type>SILVER</Type>
      <Hidden>true</Hidden>
    </Trophy>
    <Trophy>
      <Id>9</Id>
      <GameId>NPWR03160_00</GameId>
      <Title>Theatre Wizard</Title>
      <Image>http://trophy01.np.community.playstation.net/trophy/np/NPWR03160_00_14688FF02E3D5F775783097C716EE6A054A713FE/1F2EDAEF314FCD678125AAEC84EE80CE06FFE113.PNG</Image>
      <Description>Complete the Wizard Goals on Theatre of Magic® </Description>
      <Type>SILVER</Type>
      <Hidden>true</Hidden>
    </Trophy>
    <Trophy>
      <Id>10</Id>
      <GameId>NPWR03160_00</GameId>
      <Title>Black Hole High 5</Title>
      <Image>http://trophy01.np.community.playstation.net/trophy/np/NPWR03160_00_14688FF02E3D5F775783097C716EE6A054A713FE/44881B674FBE7F839185D42941CF947A38163644.PNG</Image>
      <Description>Achieve a top 5 local high score on Black Hole™</Description>
      <Type>BRONZE</Type>
      <Hidden>true</Hidden>
    </Trophy>
    <Trophy>
      <Id>11</Id>
      <GameId>NPWR03160_00</GameId>
      <Title>Black Hole Master</Title>
      <Image>http://trophy01.np.community.playstation.net/trophy/np/NPWR03160_00_14688FF02E3D5F775783097C716EE6A054A713FE/DA709B22F99A4960D197D7F7054E2D481E28658C.PNG</Image>
      <Description>Complete the Standard Goals on Black Hole™</Description>
      <Type>SILVER</Type>
      <Hidden>true</Hidden>
    </Trophy>
    <Trophy>
      <Id>12</Id>
      <GameId>NPWR03160_00</GameId>
      <Title>Black Hole Wizard</Title>
      <Image>http://trophy01.np.community.playstation.net/trophy/np/NPWR03160_00_14688FF02E3D5F775783097C716EE6A054A713FE/3AC2F27710CD5C50B154A51636DD0FA559C5746A.PNG</Image>
      <Description>Complete the Wizard Goals on Black Hole™</Description>
      <Type>SILVER</Type>
      <Hidden>true</Hidden>
    </Trophy>
  </Trophies>
</PlayStationGame>