<?xml version="1.0" encoding="utf-8"?>
<PlayStationGame xmlns:xsi="http://www.w3.org/2001/XMLSchema-instance" xsi:noNamespaceSchemaLocation="../PlayStationGame.xsd">
  <Game>
    <Id>NPWR00914_00</Id>
    <IdEurope></IdEurope>
    <Title>Buzz!™ Junior: Dino Den</Title>
    <Image>http://trophy01.np.community.playstation.net/trophy/np/NPWR00914_00_00E6B88EFF9FA0F7F2AE4B9848873FC73ABAD5912E/0E2C429BBAF62CB005157672536D7BC6EA0DCB80.PNG</Image>
    <TrophiesCount Total="11" Bronze="5" Silver="5" Gold="1" Platinum="0" />
    <TotalPoints>315</TotalPoints>
    <Platform>?</Platform>
  </Game>
  <Trophies>
    <Trophy>
      <Id>1</Id>
      <GameId>NPWR00914_00</GameId>
      <Title>Dinner Time Dino</Title>
      <Image>http://trophy01.np.community.playstation.net/trophy/np/NPWR00914_00_00E6B88EFF9FA0F7F2AE4B9848873FC73ABAD5912E/A971794B4E66739AD93A42856B110E0CAB05FCBA.PNG</Image>
      <Description>Eat more than half the steaks in a single player game of All You Can Eat!</Description>
      <Type>BRONZE</Type>
      <Hidden>false</Hidden>
    </Trophy>
    <Trophy>
      <Id>2</Id>
      <GameId>NPWR00914_00</GameId>
      <Title>Greedy Dino</Title>
      <Image>http://trophy01.np.community.playstation.net/trophy/np/NPWR00914_00_00E6B88EFF9FA0F7F2AE4B9848873FC73ABAD5912E/FCC77574B96DC51AE375541AEFAB9113F3CA1D01.PNG</Image>
      <Description>Eat all the steaks in a single player game of All You Can Eat!</Description>
      <Type>SILVER</Type>
      <Hidden>false</Hidden>
    </Trophy>
    <Trophy>
      <Id>3</Id>
      <GameId>NPWR00914_00</GameId>
      <Title>Catch of the Day</Title>
      <Image>http://trophy01.np.community.playstation.net/trophy/np/NPWR00914_00_00E6B88EFF9FA0F7F2AE4B9848873FC73ABAD5912E/15F1C30ED77E8A7BC4C153AF804B148A7ED0258A.PNG</Image>
      <Description>Catch all sizes of fish and win a single player game of Ice Fishing.</Description>
      <Type>BRONZE</Type>
      <Hidden>false</Hidden>
    </Trophy>
    <Trophy>
      <Id>4</Id>
      <GameId>NPWR00914_00</GameId>
      <Title>Fishing Frenzy</Title>
      <Image>http://trophy01.np.community.playstation.net/trophy/np/NPWR00914_00_00E6B88EFF9FA0F7F2AE4B9848873FC73ABAD5912E/A0D237D97D0DED919C2BB1D45821929FFF04AE3E.PNG</Image>
      <Description>Catch more than 340kg of fish in a single player game of Ice Fishing.</Description>
      <Type>SILVER</Type>
      <Hidden>false</Hidden>
    </Trophy>
    <Trophy>
      <Id>5</Id>
      <GameId>NPWR00914_00</GameId>
      <Title>Eat My Dust</Title>
      <Image>http://trophy01.np.community.playstation.net/trophy/np/NPWR00914_00_00E6B88EFF9FA0F7F2AE4B9848873FC73ABAD5912E/AFCF6F4D020374D691B5F35F3053D2F7FE4A7B46.PNG</Image>
      <Description>Lap an AI controlled opponent in a single player game of Elastic Racers.</Description>
      <Type>BRONZE</Type>
      <Hidden>false</Hidden>
    </Trophy>
    <Trophy>
      <Id>6</Id>
      <GameId>NPWR00914_00</GameId>
      <Title>Ace Racer</Title>
      <Image>http://trophy01.np.community.playstation.net/trophy/np/NPWR00914_00_00E6B88EFF9FA0F7F2AE4B9848873FC73ABAD5912E/D8BFD35BBCE15AADF3DFF6DB3589BFC989CCC47A.PNG</Image>
      <Description>Win a race without spinning out in a single player game of Elastic Racers.</Description>
      <Type>SILVER</Type>
      <Hidden>false</Hidden>
    </Trophy>
    <Trophy>
      <Id>7</Id>
      <GameId>NPWR00914_00</GameId>
      <Title>Hop, Skip and Dino! </Title>
      <Image>http://trophy01.np.community.playstation.net/trophy/np/NPWR00914_00_00E6B88EFF9FA0F7F2AE4B9848873FC73ABAD5912E/F200AC74293095035F883E1D538FC211B1940D4B.PNG</Image>
      <Description>Win every round in a single player game of River Crossing.</Description>
      <Type>BRONZE</Type>
      <Hidden>false</Hidden>
    </Trophy>
    <Trophy>
      <Id>8</Id>
      <GameId>NPWR00914_00</GameId>
      <Title>Mother Thumper</Title>
      <Image>http://trophy01.np.community.playstation.net/trophy/np/NPWR00914_00_00E6B88EFF9FA0F7F2AE4B9848873FC73ABAD5912E/EE24B6BABB127122DAB42F56DFD37788A586C086.PNG</Image>
      <Description>Hit 4 stalactites in a row with the highest power smash in a single player game of River Crossing.</Description>
      <Type>SILVER</Type>
      <Hidden>false</Hidden>
    </Trophy>
    <Trophy>
      <Id>9</Id>
      <GameId>NPWR00914_00</GameId>
      <Title>Easy Rider</Title>
      <Image>http://trophy01.np.community.playstation.net/trophy/np/NPWR00914_00_00E6B88EFF9FA0F7F2AE4B9848873FC73ABAD5912E/7EAC9B4D387DE70AD667B922B69F1C63D7AB61CF.PNG</Image>
      <Description>Win a single player game of Hitch A Ride!</Description>
      <Type>BRONZE</Type>
      <Hidden>false</Hidden>
    </Trophy>
    <Trophy>
      <Id>10</Id>
      <GameId>NPWR00914_00</GameId>
      <Title>T-Rex Rambler </Title>
      <Image>http://trophy01.np.community.playstation.net/trophy/np/NPWR00914_00_00E6B88EFF9FA0F7F2AE4B9848873FC73ABAD5912E/7676F46C6B1BE5A19CB750B54D7EFB357DF6CA10.PNG</Image>
      <Description>Never fall off and win a single player game of Hitch A Ride!</Description>
      <Type>SILVER</Type>
      <Hidden>false</Hidden>
    </Trophy>
    <Trophy>
      <Id>11</Id>
      <GameId>NPWR00914_00</GameId>
      <Title>Prehistoric Perfectionist</Title>
      <Image>http://trophy01.np.community.playstation.net/trophy/np/NPWR00914_00_00E6B88EFF9FA0F7F2AE4B9848873FC73ABAD5912E/2CA7ED522440AE30D6B031BE436F231EEB4998CA.PNG</Image>
      <Description>Win a standard single player game with the difficulty level set to hard.</Description>
      <Type>GOLD</Type>
      <Hidden>false</Hidden>
    </Trophy>
  </Trophies>
</PlayStationGame>