<?xml version="1.0" encoding="utf-8"?>
<PlayStationGame xmlns:xsi="http://www.w3.org/2001/XMLSchema-instance" xsi:noNamespaceSchemaLocation="../PlayStationGame.xsd">
  <Game>
    <Id>NPWR03869_00</Id>
    <IdEurope></IdEurope>
    <Title>Sonic the Fighters</Title>
    <Image>http://trophy01.np.community.playstation.net/trophy/np/NPWR03869_00_00BA8F41D091EFF291A1783EE89777E0AE68637ABA/89B6C30FAD097AD1649ADA3773733366E24ABF95.PNG</Image>
    <TrophiesCount Total="12" Bronze="7" Silver="4" Gold="1" Platinum="0" />
    <TotalPoints>315</TotalPoints>
    <Platform>?</Platform>
  </Game>
  <Trophies>
    <Trophy>
      <Id>1</Id>
      <GameId>NPWR03869_00</GameId>
      <Title>Stage 1 Complete</Title>
      <Image>http://trophy01.np.community.playstation.net/trophy/np/NPWR03869_00_00BA8F41D091EFF291A1783EE89777E0AE68637ABA/7A94A72C90F0A91DEED2F29B0A82EC3841B081F1.PNG</Image>
      <Description>Complete Stage 1 of Arcade Mode (any difficulty)</Description>
      <Type>BRONZE</Type>
      <Hidden>false</Hidden>
    </Trophy>
    <Trophy>
      <Id>2</Id>
      <GameId>NPWR03869_00</GameId>
      <Title>Stage 2 Complete</Title>
      <Image>http://trophy01.np.community.playstation.net/trophy/np/NPWR03869_00_00BA8F41D091EFF291A1783EE89777E0AE68637ABA/1D4790FACD55D205521CF76B889A7FC550C5454B.PNG</Image>
      <Description>Complete Stage 2 of Arcade Mode (any difficulty)</Description>
      <Type>BRONZE</Type>
      <Hidden>false</Hidden>
    </Trophy>
    <Trophy>
      <Id>3</Id>
      <GameId>NPWR03869_00</GameId>
      <Title>Stage 3 Complete</Title>
      <Image>http://trophy01.np.community.playstation.net/trophy/np/NPWR03869_00_00BA8F41D091EFF291A1783EE89777E0AE68637ABA/D4332866DFF26CD45CF967E449AFC3C27DE987D2.PNG</Image>
      <Description>Complete Stage 3 of Arcade Mode (any difficulty)</Description>
      <Type>BRONZE</Type>
      <Hidden>false</Hidden>
    </Trophy>
    <Trophy>
      <Id>4</Id>
      <GameId>NPWR03869_00</GameId>
      <Title>Stage 4 Complete</Title>
      <Image>http://trophy01.np.community.playstation.net/trophy/np/NPWR03869_00_00BA8F41D091EFF291A1783EE89777E0AE68637ABA/6CCED5F2FFBDDF8B194AE44DB03DD7D38BA407D3.PNG</Image>
      <Description>Complete Stage 4 of Arcade Mode (any difficulty)</Description>
      <Type>BRONZE</Type>
      <Hidden>false</Hidden>
    </Trophy>
    <Trophy>
      <Id>5</Id>
      <GameId>NPWR03869_00</GameId>
      <Title>Stage 5 Complete</Title>
      <Image>http://trophy01.np.community.playstation.net/trophy/np/NPWR03869_00_00BA8F41D091EFF291A1783EE89777E0AE68637ABA/49F68D9091B4283FCFFD9AAE61DDA2DDC5C04125.PNG</Image>
      <Description>Complete Stage 5 of Arcade Mode (any difficulty)</Description>
      <Type>BRONZE</Type>
      <Hidden>false</Hidden>
    </Trophy>
    <Trophy>
      <Id>6</Id>
      <GameId>NPWR03869_00</GameId>
      <Title>Stage 6 Complete</Title>
      <Image>http://trophy01.np.community.playstation.net/trophy/np/NPWR03869_00_00BA8F41D091EFF291A1783EE89777E0AE68637ABA/EE05BA7982150E1CEC5C8AF0FFAD4F12DB3CAC45.PNG</Image>
      <Description>Complete Stage 6 of Arcade Mode (any difficulty)</Description>
      <Type>BRONZE</Type>
      <Hidden>false</Hidden>
    </Trophy>
    <Trophy>
      <Id>7</Id>
      <GameId>NPWR03869_00</GameId>
      <Title>Stage 7 Complete</Title>
      <Image>http://trophy01.np.community.playstation.net/trophy/np/NPWR03869_00_00BA8F41D091EFF291A1783EE89777E0AE68637ABA/37E1410006510055F36ABD1BFB2E92ED5D316B03.PNG</Image>
      <Description>Complete Stage 7 of Arcade Mode (any difficulty)</Description>
      <Type>BRONZE</Type>
      <Hidden>false</Hidden>
    </Trophy>
    <Trophy>
      <Id>8</Id>
      <GameId>NPWR03869_00</GameId>
      <Title>Perfect</Title>
      <Image>http://trophy01.np.community.playstation.net/trophy/np/NPWR03869_00_00BA8F41D091EFF291A1783EE89777E0AE68637ABA/0935AC9D267B17E3D1FBF6F2C13659EF5C1DD4A0.PNG</Image>
      <Description>Win a round without receiving any damage in Arcade Mode (any difficulty)</Description>
      <Type>GOLD</Type>
      <Hidden>false</Hidden>
    </Trophy>
    <Trophy>
      <Id>9</Id>
      <GameId>NPWR03869_00</GameId>
      <Title>Barrier Destroyer</Title>
      <Image>http://trophy01.np.community.playstation.net/trophy/np/NPWR03869_00_00BA8F41D091EFF291A1783EE89777E0AE68637ABA/5C1BEC8A6800F46A18491082A24D4BC18F4E6B7F.PNG</Image>
      <Description>Destroy all of an opponent's barriers while playing Arcade Mode or Offline Versus</Description>
      <Type>SILVER</Type>
      <Hidden>false</Hidden>
    </Trophy>
    <Trophy>
      <Id>10</Id>
      <GameId>NPWR03869_00</GameId>
      <Title>A Small Transformation</Title>
      <Image>http://trophy01.np.community.playstation.net/trophy/np/NPWR03869_00_00BA8F41D091EFF291A1783EE89777E0AE68637ABA/E51249F2DDE6DE62484CF9F977964EC141D2B4E7.PNG</Image>
      <Description>Turn small by being attacked (ie, by Amy's↓+P, etc) in Arcade Mode or Offline Versus</Description>
      <Type>SILVER</Type>
      <Hidden>false</Hidden>
    </Trophy>
    <Trophy>
      <Id>11</Id>
      <GameId>NPWR03869_00</GameId>
      <Title>Honey the Cat</Title>
      <Image>http://trophy01.np.community.playstation.net/trophy/np/NPWR03869_00_00BA8F41D091EFF291A1783EE89777E0AE68637ABA/F41252BF67377E3D57842E26D30DE2F69598D6E1.PNG</Image>
      <Description>Use Honey the Cat in Arcade Mode or Offline Versus (Press START button on Amy and select)</Description>
      <Type>SILVER</Type>
      <Hidden>false</Hidden>
    </Trophy>
    <Trophy>
      <Id>12</Id>
      <GameId>NPWR03869_00</GameId>
      <Title>The Enemy Within</Title>
      <Image>http://trophy01.np.community.playstation.net/trophy/np/NPWR03869_00_00BA8F41D091EFF291A1783EE89777E0AE68637ABA/3CBB98BFACECD474F678897A1AD09A9DC63A917D.PNG</Image>
      <Description>Fight a mirror match in Arcade Mode or Offline Versus</Description>
      <Type>SILVER</Type>
      <Hidden>false</Hidden>
    </Trophy>
  </Trophies>
</PlayStationGame>