<?xml version="1.0" encoding="utf-8"?>
<PlayStationGame xmlns:xsi="http://www.w3.org/2001/XMLSchema-instance" xsi:noNamespaceSchemaLocation="../PlayStationGame.xsd">
  <Game>
    <Id>NPWR00106_00</Id>
    <IdEurope></IdEurope>
    <Title>Wheel of Fortune</Title>
    <Image>http://trophy01.np.community.playstation.net/trophy/np/NPWR00106_00_9527273DF39454FDBDB43B4640F5A7DB4A1AF364/3E6755A21F6C3FB3A445A1838A227B1841534A19.PNG</Image>
    <TrophiesCount Total="13" Bronze="9" Silver="3" Gold="1" Platinum="0" />
    <TotalPoints>315</TotalPoints>
    <Platform>ps3</Platform>
  </Game>
  <Trophies>
    <Trophy>
      <Id>1</Id>
      <GameId>NPWR00106_00</GameId>
      <Title>Wheel Barrel of Fortune</Title>
      <Image>http://trophy01.np.community.playstation.net/trophy/np/NPWR00106_00_9527273DF39454FDBDB43B4640F5A7DB4A1AF364/800B6266CA4146D01BEB955E20C2AF7141950727.PNG</Image>
      <Description>$100,000 total winnings</Description>
      <Type>BRONZE</Type>
      <Hidden>false</Hidden>
    </Trophy>
    <Trophy>
      <Id>2</Id>
      <GameId>NPWR00106_00</GameId>
      <Title>Wheel of Fortune 500</Title>
      <Image>http://trophy01.np.community.playstation.net/trophy/np/NPWR00106_00_9527273DF39454FDBDB43B4640F5A7DB4A1AF364/89787F68F17D11A733FF27327FAA87EAD8A2D400.PNG</Image>
      <Description>$500,000 total winnings</Description>
      <Type>SILVER</Type>
      <Hidden>false</Hidden>
    </Trophy>
    <Trophy>
      <Id>3</Id>
      <GameId>NPWR00106_00</GameId>
      <Title>Inventor of the Wheel</Title>
      <Image>http://trophy01.np.community.playstation.net/trophy/np/NPWR00106_00_9527273DF39454FDBDB43B4640F5A7DB4A1AF364/BACA9C6EFB023494CD9C33BBE6EAC993D149FF25.PNG</Image>
      <Description>$1,000,000 total winnings</Description>
      <Type>GOLD</Type>
      <Hidden>false</Hidden>
    </Trophy>
    <Trophy>
      <Id>4</Id>
      <GameId>NPWR00106_00</GameId>
      <Title>Wheely Wheely Good</Title>
      <Image>http://trophy01.np.community.playstation.net/trophy/np/NPWR00106_00_9527273DF39454FDBDB43B4640F5A7DB4A1AF364/E55715735343C2521FB303232EB3C3BE2DF36372.PNG</Image>
      <Description>$50,000 winnings in one game</Description>
      <Type>BRONZE</Type>
      <Hidden>false</Hidden>
    </Trophy>
    <Trophy>
      <Id>5</Id>
      <GameId>NPWR00106_00</GameId>
      <Title>Wheel Around the World</Title>
      <Image>http://trophy01.np.community.playstation.net/trophy/np/NPWR00106_00_9527273DF39454FDBDB43B4640F5A7DB4A1AF364/6F3F8D0912395FFD7E269562CB7A0E355D24E5CE.PNG</Image>
      <Description>Win an online game</Description>
      <Type>BRONZE</Type>
      <Hidden>false</Hidden>
    </Trophy>
    <Trophy>
      <Id>6</Id>
      <GameId>NPWR00106_00</GameId>
      <Title>Lucky Letter</Title>
      <Image>http://trophy01.np.community.playstation.net/trophy/np/NPWR00106_00_9527273DF39454FDBDB43B4640F5A7DB4A1AF364/5E7DC450238AC7BED60D9C073AB77203F3A5C935.PNG</Image>
      <Description>Correctly select Q, X, or Z in a puzzle</Description>
      <Type>BRONZE</Type>
      <Hidden>false</Hidden>
    </Trophy>
    <Trophy>
      <Id>7</Id>
      <GameId>NPWR00106_00</GameId>
      <Title>Ding Ding Ding Ding</Title>
      <Image>http://trophy01.np.community.playstation.net/trophy/np/NPWR00106_00_9527273DF39454FDBDB43B4640F5A7DB4A1AF364/E3896CA1E9C266BBCB0EE12B0980F9776A2AD224.PNG</Image>
      <Description>Pick a letter that shows up 4 or more times in a puzzle</Description>
      <Type>BRONZE</Type>
      <Hidden>false</Hidden>
    </Trophy>
    <Trophy>
      <Id>8</Id>
      <GameId>NPWR00106_00</GameId>
      <Title>Puzzle Apprentice</Title>
      <Image>http://trophy01.np.community.playstation.net/trophy/np/NPWR00106_00_9527273DF39454FDBDB43B4640F5A7DB4A1AF364/FF9A66F8CC7914546EF6F3DB495F062CB75F5D9F.PNG</Image>
      <Description>Win 10 games</Description>
      <Type>BRONZE</Type>
      <Hidden>false</Hidden>
    </Trophy>
    <Trophy>
      <Id>9</Id>
      <GameId>NPWR00106_00</GameId>
      <Title>Puzzle Master</Title>
      <Image>http://trophy01.np.community.playstation.net/trophy/np/NPWR00106_00_9527273DF39454FDBDB43B4640F5A7DB4A1AF364/B4D5877E1D251773C2F2D349E4E89CD1FC378755.PNG</Image>
      <Description>Win 25 games</Description>
      <Type>SILVER</Type>
      <Hidden>false</Hidden>
    </Trophy>
    <Trophy>
      <Id>10</Id>
      <GameId>NPWR00106_00</GameId>
      <Title>Wheel Consistent</Title>
      <Image>http://trophy01.np.community.playstation.net/trophy/np/NPWR00106_00_9527273DF39454FDBDB43B4640F5A7DB4A1AF364/96B3A513646A813CB6D660459FA6C1C241198EB7.PNG</Image>
      <Description>Pick 5 letters in a row in one puzzle</Description>
      <Type>BRONZE</Type>
      <Hidden>false</Hidden>
    </Trophy>
    <Trophy>
      <Id>11</Id>
      <GameId>NPWR00106_00</GameId>
      <Title>Road Warrior</Title>
      <Image>http://trophy01.np.community.playstation.net/trophy/np/NPWR00106_00_9527273DF39454FDBDB43B4640F5A7DB4A1AF364/0EEA72C223091BE1C49A09DCE732C10E556F1CD5.PNG</Image>
      <Description>Visit all cities in Road Trip mode</Description>
      <Type>SILVER</Type>
      <Hidden>false</Hidden>
    </Trophy>
    <Trophy>
      <Id>12</Id>
      <GameId>NPWR00106_00</GameId>
      <Title>Wheel Spinner</Title>
      <Image>http://trophy01.np.community.playstation.net/trophy/np/NPWR00106_00_9527273DF39454FDBDB43B4640F5A7DB4A1AF364/565195C9F2852F774CF0A17DD64B0448153A4543.PNG</Image>
      <Description>Win a round</Description>
      <Type>BRONZE</Type>
      <Hidden>false</Hidden>
    </Trophy>
    <Trophy>
      <Id>13</Id>
      <GameId>NPWR00106_00</GameId>
      <Title>Wheel Winner</Title>
      <Image>http://trophy01.np.community.playstation.net/trophy/np/NPWR00106_00_9527273DF39454FDBDB43B4640F5A7DB4A1AF364/D3F39F8A158D0C072E1DF24C2DECF13D10738A8C.PNG</Image>
      <Description>Win a local game</Description>
      <Type>BRONZE</Type>
      <Hidden>false</Hidden>
    </Trophy>
  </Trophies>
</PlayStationGame>