<?xml version="1.0" encoding="utf-8"?>
<PlayStationGame xmlns:xsi="http://www.w3.org/2001/XMLSchema-instance" xsi:noNamespaceSchemaLocation="../PlayStationGame.xsd">
  <Game>
    <Id>NPWR01080_00</Id>
    <IdEurope></IdEurope>
    <Title>Top Gun</Title>
    <Image>http://trophy01.np.community.playstation.net/trophy/np/NPWR01080_00_873D1E036E092F1B8321D1825B8B902D8AC2FA49/EBC8C3F30A8AA0BF352E93D8176453CB254C1068.PNG</Image>
    <TrophiesCount Total="12" Bronze="8" Silver="3" Gold="1" Platinum="0" />
    <TotalPoints>300</TotalPoints>
    <Platform>ps3</Platform>
  </Game>
  <Trophies>
    <Trophy>
      <Id>1</Id>
      <GameId>NPWR01080_00</GameId>
      <Title>I feel the need...</Title>
      <Image>http://trophy01.np.community.playstation.net/trophy/np/NPWR01080_00_873D1E036E092F1B8321D1825B8B902D8AC2FA49/FFDDD06AA22331ED61032FBF903C6BD0C34534DD.PNG</Image>
      <Description>Awarded after 3 afterburner boosts.</Description>
      <Type>BRONZE</Type>
      <Hidden xsi:nil="true" />
    </Trophy>
    <Trophy>
      <Id>2</Id>
      <GameId>NPWR01080_00</GameId>
      <Title>Gutsiest move I ever saw..</Title>
      <Image>http://trophy01.np.community.playstation.net/trophy/np/NPWR01080_00_873D1E036E092F1B8321D1825B8B902D8AC2FA49/BDA4C3E3F56A7BB9AFFA9031819B0B32F2E708AD.PNG</Image>
      <Description>First plane locked onto with missiles when in CFI and then successfully killed.</Description>
      <Type>BRONZE</Type>
      <Hidden xsi:nil="true" />
    </Trophy>
    <Trophy>
      <Id>3</Id>
      <GameId>NPWR01080_00</GameId>
      <Title>Jester’s Dead</Title>
      <Image>http://trophy01.np.community.playstation.net/trophy/np/NPWR01080_00_873D1E036E092F1B8321D1825B8B902D8AC2FA49/033747C2667AE2E230793FB5829B0518271D9113.PNG</Image>
      <Description>Jester is shot down at any point by either you or your wingman.</Description>
      <Type>BRONZE</Type>
      <Hidden xsi:nil="true" />
    </Trophy>
    <Trophy>
      <Id>4</Id>
      <GameId>NPWR01080_00</GameId>
      <Title>Close But No Cigar</Title>
      <Image>http://trophy01.np.community.playstation.net/trophy/np/NPWR01080_00_873D1E036E092F1B8321D1825B8B902D8AC2FA49/3E3862B83845EB0E8023D5C1C26CA9E63E12B8ED.PNG</Image>
      <Description>Mission 4 (1st playthrough – Viper wins).</Description>
      <Type>BRONZE</Type>
      <Hidden xsi:nil="true" />
    </Trophy>
    <Trophy>
      <Id>5</Id>
      <GameId>NPWR01080_00</GameId>
      <Title>Top Gun</Title>
      <Image>http://trophy01.np.community.playstation.net/trophy/np/NPWR01080_00_873D1E036E092F1B8321D1825B8B902D8AC2FA49/A2C16863E3B827639F637A66D4E991F2ED0E8361.PNG</Image>
      <Description>Mission 4 (2nd playthrough – Player wins).</Description>
      <Type>BRONZE</Type>
      <Hidden xsi:nil="true" />
    </Trophy>
    <Trophy>
      <Id>6</Id>
      <GameId>NPWR01080_00</GameId>
      <Title>You can be my wingman anytime...</Title>
      <Image>http://trophy01.np.community.playstation.net/trophy/np/NPWR01080_00_873D1E036E092F1B8321D1825B8B902D8AC2FA49/14224966B1D6902C06393848CE339C88768FA98E.PNG</Image>
      <Description>Complete all the Indian Ocean Missions.</Description>
      <Type>SILVER</Type>
      <Hidden xsi:nil="true" />
    </Trophy>
    <Trophy>
      <Id>7</Id>
      <GameId>NPWR01080_00</GameId>
      <Title>The Pattern is Full</Title>
      <Image>http://trophy01.np.community.playstation.net/trophy/np/NPWR01080_00_873D1E036E092F1B8321D1825B8B902D8AC2FA49/9758302FA27E6467637055F280496043F8BDB6ED.PNG</Image>
      <Description>Complete all of Prologue, Top Gun Academy and Indian Ocean with all planes (any difficulty).</Description>
      <Type>GOLD</Type>
      <Hidden xsi:nil="true" />
    </Trophy>
    <Trophy>
      <Id>8</Id>
      <GameId>NPWR01080_00</GameId>
      <Title>You’re Dangerous</Title>
      <Image>http://trophy01.np.community.playstation.net/trophy/np/NPWR01080_00_873D1E036E092F1B8321D1825B8B902D8AC2FA49/68CAE6F40F770D964EEBCDD6007F30685B06A20C.PNG</Image>
      <Description>Complete any one of three hidden flight runs.</Description>
      <Type>BRONZE</Type>
      <Hidden xsi:nil="true" />
    </Trophy>
    <Trophy>
      <Id>9</Id>
      <GameId>NPWR01080_00</GameId>
      <Title>That’s Right, I am Dangerous</Title>
      <Image>http://trophy01.np.community.playstation.net/trophy/np/NPWR01080_00_873D1E036E092F1B8321D1825B8B902D8AC2FA49/DB112C82C00DD924B095824071686CB756A4B57A.PNG</Image>
      <Description>Complete all 3 of the hidden runs.</Description>
      <Type>SILVER</Type>
      <Hidden xsi:nil="true" />
    </Trophy>
    <Trophy>
      <Id>10</Id>
      <GameId>NPWR01080_00</GameId>
      <Title>Target Rich Environment</Title>
      <Image>http://trophy01.np.community.playstation.net/trophy/np/NPWR01080_00_873D1E036E092F1B8321D1825B8B902D8AC2FA49/F6980485DE5B91D276F9762F3B8C3265FF511374.PNG</Image>
      <Description>99 kills in Multiplayer (with Missiles or Guns).</Description>
      <Type>BRONZE</Type>
      <Hidden xsi:nil="true" />
    </Trophy>
    <Trophy>
      <Id>11</Id>
      <GameId>NPWR01080_00</GameId>
      <Title>Goosed</Title>
      <Image>http://trophy01.np.community.playstation.net/trophy/np/NPWR01080_00_873D1E036E092F1B8321D1825B8B902D8AC2FA49/881537095296B55DD3D3D22ECC5116008BCC6BF3.PNG</Image>
      <Description>Rewarded for more than 10 gratuitous deaths in a single multiplayer match.</Description>
      <Type>BRONZE</Type>
      <Hidden xsi:nil="true" />
    </Trophy>
    <Trophy>
      <Id>12</Id>
      <GameId>NPWR01080_00</GameId>
      <Title>No Points For Second Place</Title>
      <Image>http://trophy01.np.community.playstation.net/trophy/np/NPWR01080_00_873D1E036E092F1B8321D1825B8B902D8AC2FA49/18C620CD237E9A5DE0413341E7CBBB6EF16227B0.PNG</Image>
      <Description>Be the first to get the star in a multiplayer match, and hold on to it until the bitter end.</Description>
      <Type>SILVER</Type>
      <Hidden xsi:nil="true" />
    </Trophy>
  </Trophies>
</PlayStationGame>