<?xml version="1.0" encoding="utf-8"?>
<PlayStationGame xmlns:xsi="http://www.w3.org/2001/XMLSchema-instance" xsi:noNamespaceSchemaLocation="../PlayStationGame.xsd">
  <Game>
    <Id>NPWR01706_00</Id>
    <IdEurope></IdEurope>
    <Title>Dead Block</Title>
    <Image>http://trophy01.np.community.playstation.net/trophy/np/NPWR01706_00_01EEAC2B90275E171F41907DB5BB027B2603AE17/C6245EC19AFA410EB7C41B2104000B787FD16E88.PNG</Image>
    <TrophiesCount Total="12" Bronze="8" Silver="3" Gold="1" Platinum="0" />
    <TotalPoints>300</TotalPoints>
    <Platform>ps3</Platform>
  </Game>
  <Trophies>
    <Trophy>
      <Id>1</Id>
      <GameId>NPWR01706_00</GameId>
      <Title>Jack the Builder</Title>
      <Image>http://trophy01.np.community.playstation.net/trophy/np/NPWR01706_00_01EEAC2B90275E171F41907DB5BB027B2603AE17/F78F04CEFD06073E4DEDB810DDC6615192A66023.PNG</Image>
      <Description>Put blockades on every door and window in one level.</Description>
      <Type>BRONZE</Type>
      <Hidden xsi:nil="true" />
    </Trophy>
    <Trophy>
      <Id>2</Id>
      <GameId>NPWR01706_00</GameId>
      <Title>Poo Dance</Title>
      <Image>http://trophy01.np.community.playstation.net/trophy/np/NPWR01706_00_01EEAC2B90275E171F41907DB5BB027B2603AE17/43E641BF01A4303AB537C3702A2570D3E4172345.PNG</Image>
      <Description>Make ten infected zombies dance at the same time.</Description>
      <Type>SILVER</Type>
      <Hidden xsi:nil="true" />
    </Trophy>
    <Trophy>
      <Id>3</Id>
      <GameId>NPWR01706_00</GameId>
      <Title>Nightshift</Title>
      <Image>http://trophy01.np.community.playstation.net/trophy/np/NPWR01706_00_01EEAC2B90275E171F41907DB5BB027B2603AE17/256D8D7E187CEF14A0DD95E9EBEB7433A58B29CA.PNG</Image>
      <Description>Play five minutes in darkness.</Description>
      <Type>BRONZE</Type>
      <Hidden xsi:nil="true" />
    </Trophy>
    <Trophy>
      <Id>4</Id>
      <GameId>NPWR01706_00</GameId>
      <Title>All Traps</Title>
      <Image>http://trophy01.np.community.playstation.net/trophy/np/NPWR01706_00_01EEAC2B90275E171F41907DB5BB027B2603AE17/5471884B3F23685D8D6D5878710797CC15909EC4.PNG</Image>
      <Description>Build every trap and a wood blockade in one level.</Description>
      <Type>SILVER</Type>
      <Hidden xsi:nil="true" />
    </Trophy>
    <Trophy>
      <Id>5</Id>
      <GameId>NPWR01706_00</GameId>
      <Title>Bomber</Title>
      <Image>http://trophy01.np.community.playstation.net/trophy/np/NPWR01706_00_01EEAC2B90275E171F41907DB5BB027B2603AE17/A3575C21AC7309A9CE40803999B2BA9629882A07.PNG</Image>
      <Description>Kill twenty zombies with a single bomb trap.</Description>
      <Type>BRONZE</Type>
      <Hidden xsi:nil="true" />
    </Trophy>
    <Trophy>
      <Id>6</Id>
      <GameId>NPWR01706_00</GameId>
      <Title>Work force</Title>
      <Image>http://trophy01.np.community.playstation.net/trophy/np/NPWR01706_00_01EEAC2B90275E171F41907DB5BB027B2603AE17/505368AA8CFFEC6C04DBF68EB056FF4DC828C65F.PNG</Image>
      <Description>Employ 20 construction zombies at the same time.</Description>
      <Type>BRONZE</Type>
      <Hidden xsi:nil="true" />
    </Trophy>
    <Trophy>
      <Id>7</Id>
      <GameId>NPWR01706_00</GameId>
      <Title>Dead can Dance</Title>
      <Image>http://trophy01.np.community.playstation.net/trophy/np/NPWR01706_00_01EEAC2B90275E171F41907DB5BB027B2603AE17/29738898819DEBC7D5AED1A26A10641C5925C2FF.PNG</Image>
      <Description>Activate the Jukebox and make a zombie dance.</Description>
      <Type>BRONZE</Type>
      <Hidden xsi:nil="true" />
    </Trophy>
    <Trophy>
      <Id>8</Id>
      <GameId>NPWR01706_00</GameId>
      <Title>Cactustime</Title>
      <Image>http://trophy01.np.community.playstation.net/trophy/np/NPWR01706_00_01EEAC2B90275E171F41907DB5BB027B2603AE17/3EC736A6C9E8266B4DD0CFD713937BE440864AA9.PNG</Image>
      <Description>While playing Mike, search four cacti in a row.</Description>
      <Type>BRONZE</Type>
      <Hidden xsi:nil="true" />
    </Trophy>
    <Trophy>
      <Id>9</Id>
      <GameId>NPWR01706_00</GameId>
      <Title>Quintupel Super Awesome</Title>
      <Image>http://trophy01.np.community.playstation.net/trophy/np/NPWR01706_00_01EEAC2B90275E171F41907DB5BB027B2603AE17/CC1132F2889B660D4FADDE8DA0352A019F58BB8C.PNG</Image>
      <Description>Build five blockades with super awesome finish in a row.</Description>
      <Type>BRONZE</Type>
      <Hidden xsi:nil="true" />
    </Trophy>
    <Trophy>
      <Id>10</Id>
      <GameId>NPWR01706_00</GameId>
      <Title>Multikill</Title>
      <Image>http://trophy01.np.community.playstation.net/trophy/np/NPWR01706_00_01EEAC2B90275E171F41907DB5BB027B2603AE17/751BAC413B891DE156BF22B5433F5EF371582555.PNG</Image>
      <Description>While playing Foxy, kill three zombies with one melee attack.</Description>
      <Type>BRONZE</Type>
      <Hidden xsi:nil="true" />
    </Trophy>
    <Trophy>
      <Id>11</Id>
      <GameId>NPWR01706_00</GameId>
      <Title>Game Complete</Title>
      <Image>http://trophy01.np.community.playstation.net/trophy/np/NPWR01706_00_01EEAC2B90275E171F41907DB5BB027B2603AE17/91AE378BEF55F8B449450E5FCF51F08544EA395B.PNG</Image>
      <Description>Complete all singleplayer levels.</Description>
      <Type>SILVER</Type>
      <Hidden xsi:nil="true" />
    </Trophy>
    <Trophy>
      <Id>12</Id>
      <GameId>NPWR01706_00</GameId>
      <Title>Medal Seeker</Title>
      <Image>http://trophy01.np.community.playstation.net/trophy/np/NPWR01706_00_01EEAC2B90275E171F41907DB5BB027B2603AE17/BD18362C468A2E875B5E1465D144E41CAE1FC42A.PNG</Image>
      <Description>Win all gold medals in all singleplayer levels.</Description>
      <Type>GOLD</Type>
      <Hidden xsi:nil="true" />
    </Trophy>
  </Trophies>
</PlayStationGame>