<?xml version="1.0" encoding="utf-8"?>
<PlayStationGame xmlns:xsi="http://www.w3.org/2001/XMLSchema-instance" xsi:noNamespaceSchemaLocation="../PlayStationGame.xsd">
  <Game>
    <Id>NPWR03597_00</Id>
    <IdEurope></IdEurope>
    <Title>Double Dragon Neon</Title>
    <Image>http://trophy01.np.community.playstation.net/trophy/np/NPWR03597_00_B4069AB5594A2D943BAFB34D8D0D29C9965AC037/4C7B4CE5428590CD5FD1CDDC9E702FA095BA2A92.PNG</Image>
    <TrophiesCount Total="13" Bronze="9" Silver="3" Gold="1" Platinum="0" />
    <TotalPoints>315</TotalPoints>
    <Platform>ps3</Platform>
  </Game>
  <Trophies>
    <Trophy>
      <Id>1</Id>
      <GameId>NPWR03597_00</GameId>
      <Title>FuzzFace!!</Title>
      <Image>http://trophy01.np.community.playstation.net/trophy/np/NPWR03597_00_B4069AB5594A2D943BAFB34D8D0D29C9965AC037/DAD0C4E4EB774B7281E8B76AE204649D3DA3E3C2.PNG</Image>
      <Description>Befriend everyone's most favoritest helpful character!</Description>
      <Type>BRONZE</Type>
      <Hidden>true</Hidden>
    </Trophy>
    <Trophy>
      <Id>2</Id>
      <GameId>NPWR03597_00</GameId>
      <Title>Metal Head</Title>
      <Image>http://trophy01.np.community.playstation.net/trophy/np/NPWR03597_00_B4069AB5594A2D943BAFB34D8D0D29C9965AC037/4AFA50C975B74357C0A82BF9F41EC48B53222BB3.PNG</Image>
      <Description>Upgrade a song at the Tapesmith</Description>
      <Type>BRONZE</Type>
      <Hidden>false</Hidden>
    </Trophy>
    <Trophy>
      <Id>3</Id>
      <GameId>NPWR03597_00</GameId>
      <Title>Weapon Master</Title>
      <Image>http://trophy01.np.community.playstation.net/trophy/np/NPWR03597_00_B4069AB5594A2D943BAFB34D8D0D29C9965AC037/73D8CD5691CD840BAD597C3A53A8E2AAA9EFF628.PNG</Image>
      <Description>Use every weapon once</Description>
      <Type>BRONZE</Type>
      <Hidden>false</Hidden>
    </Trophy>
    <Trophy>
      <Id>4</Id>
      <GameId>NPWR03597_00</GameId>
      <Title>A Foot Face?</Title>
      <Image>http://trophy01.np.community.playstation.net/trophy/np/NPWR03597_00_B4069AB5594A2D943BAFB34D8D0D29C9965AC037/D7B168B03936418497CDE051AEB848EC7A67E8DC.PNG</Image>
      <Description>Become the hidden idol!</Description>
      <Type>BRONZE</Type>
      <Hidden>true</Hidden>
    </Trophy>
    <Trophy>
      <Id>5</Id>
      <GameId>NPWR03597_00</GameId>
      <Title>Gleam On!</Title>
      <Image>http://trophy01.np.community.playstation.net/trophy/np/NPWR03597_00_B4069AB5594A2D943BAFB34D8D0D29C9965AC037/25C4AB2EC5D5B9CAD56600C402053B78EFA9EFE7.PNG</Image>
      <Description>Dodge and get the Gleam 50 times</Description>
      <Type>BRONZE</Type>
      <Hidden>false</Hidden>
    </Trophy>
    <Trophy>
      <Id>6</Id>
      <GameId>NPWR03597_00</GameId>
      <Title>Mr. Perfect</Title>
      <Image>http://trophy01.np.community.playstation.net/trophy/np/NPWR03597_00_B4069AB5594A2D943BAFB34D8D0D29C9965AC037/F17290F28E1141224C4967B7E9A6515D8FB2B459.PNG</Image>
      <Description>Complete any level without taking damage</Description>
      <Type>BRONZE</Type>
      <Hidden>false</Hidden>
    </Trophy>
    <Trophy>
      <Id>7</Id>
      <GameId>NPWR03597_00</GameId>
      <Title>This Channel Sucks</Title>
      <Image>http://trophy01.np.community.playstation.net/trophy/np/NPWR03597_00_B4069AB5594A2D943BAFB34D8D0D29C9965AC037/8F3A16917F454E8C6392143D23E2BED66C0CB4E8.PNG</Image>
      <Description>Break all the Skullmageddon monitors in the Rocket Dojo</Description>
      <Type>BRONZE</Type>
      <Hidden>false</Hidden>
    </Trophy>
    <Trophy>
      <Id>8</Id>
      <GameId>NPWR03597_00</GameId>
      <Title>Pick a Winner!</Title>
      <Image>http://trophy01.np.community.playstation.net/trophy/np/NPWR03597_00_B4069AB5594A2D943BAFB34D8D0D29C9965AC037/4D03C12E70174C93CA5B89999819CF4672443327.PNG</Image>
      <Description>Nail all enemies with the hair pick</Description>
      <Type>BRONZE</Type>
      <Hidden>false</Hidden>
    </Trophy>
    <Trophy>
      <Id>9</Id>
      <GameId>NPWR03597_00</GameId>
      <Title>Victory!</Title>
      <Image>http://trophy01.np.community.playstation.net/trophy/np/NPWR03597_00_B4069AB5594A2D943BAFB34D8D0D29C9965AC037/26D25261386246C04B8B48B44BB98589D7334ECE.PNG</Image>
      <Description>Defeat Skullmageddon!</Description>
      <Type>BRONZE</Type>
      <Hidden>false</Hidden>
    </Trophy>
    <Trophy>
      <Id>10</Id>
      <GameId>NPWR03597_00</GameId>
      <Title>Misters Perfect</Title>
      <Image>http://trophy01.np.community.playstation.net/trophy/np/NPWR03597_00_B4069AB5594A2D943BAFB34D8D0D29C9965AC037/D0EBE709DDBF2987BBD5D985B7EB55CF694EB165.PNG</Image>
      <Description>Complete any level in co-op without taking any damage... with friendly fire enabled!</Description>
      <Type>SILVER</Type>
      <Hidden>false</Hidden>
    </Trophy>
    <Trophy>
      <Id>11</Id>
      <GameId>NPWR03597_00</GameId>
      <Title>Double Dragon</Title>
      <Image>http://trophy01.np.community.playstation.net/trophy/np/NPWR03597_00_B4069AB5594A2D943BAFB34D8D0D29C9965AC037/BE81D4DF7AB3F519A1F60FA9F7D69F8A7819DC4B.PNG</Image>
      <Description>Finish every stage cooperatively on Double Dragon difficulty with friendly fire enabled!</Description>
      <Type>SILVER</Type>
      <Hidden>false</Hidden>
    </Trophy>
    <Trophy>
      <Id>12</Id>
      <GameId>NPWR03597_00</GameId>
      <Title>Max Fidelity</Title>
      <Image>http://trophy01.np.community.playstation.net/trophy/np/NPWR03597_00_B4069AB5594A2D943BAFB34D8D0D29C9965AC037/6F351768AE5D9501E14A3A563338AD17B99B760B.PNG</Image>
      <Description>Max out every song to level 50!!</Description>
      <Type>GOLD</Type>
      <Hidden>false</Hidden>
    </Trophy>
    <Trophy>
      <Id>13</Id>
      <GameId>NPWR03597_00</GameId>
      <Title>Single Dragon</Title>
      <Image>http://trophy01.np.community.playstation.net/trophy/np/NPWR03597_00_B4069AB5594A2D943BAFB34D8D0D29C9965AC037/150A82BB0A557186A1B3C7740C26D4BA7E01B77D.PNG</Image>
      <Description>Finish every stage solo on Double Dragon difficulty!</Description>
      <Type>SILVER</Type>
      <Hidden>false</Hidden>
    </Trophy>
  </Trophies>
</PlayStationGame>