<?xml version="1.0" encoding="utf-8"?>
<PlayStationGame xmlns:xsi="http://www.w3.org/2001/XMLSchema-instance" xsi:noNamespaceSchemaLocation="../PlayStationGame.xsd">
  <Game>
    <Id>NPWR01320_00</Id>
    <IdEurope></IdEurope>
    <Title>SCOTT PILGRIM VS. THE WORLD: THE GAME</Title>
    <Image>http://trophy01.np.community.playstation.net/trophy/np/NPWR01320_00_016D1DF1690A1AC3CBE4E1C355E3DC554A173FAA31/83228FE7E66BCD07AFD58A28A2FF73ADA1925F27.PNG</Image>
    <TrophiesCount Total="19" Bronze="11" Silver="6" Gold="2" Platinum="0" />
    <TotalPoints>525</TotalPoints>
    <Platform>ps3</Platform>
  </Game>
  <Trophies>
    <Trophy>
      <Id>1</Id>
      <GameId>NPWR01320_00</GameId>
      <Title>New Challenger</Title>
      <Image>http://trophy01.np.community.playstation.net/trophy/np/NPWR01320_00_99AEBDAD64F168E03AAB052300041E4C358A654C/956AA4246BD3C12F96A860EFD8EA3A4511877713.PNG</Image>
      <Description>Defeat Matthew Patel without losing a life.</Description>
      <Type>BRONZE</Type>
      <Hidden>false</Hidden>
    </Trophy>
    <Trophy>
      <Id>2</Id>
      <GameId>NPWR01320_00</GameId>
      <Title>Twin Dragons</Title>
      <Image>http://trophy01.np.community.playstation.net/trophy/np/NPWR01320_00_99AEBDAD64F168E03AAB052300041E4C358A654C/2844D652E3A00913BA778CAD76A2816E530FA667.PNG</Image>
      <Description>Defeat the Twins simultaneously.</Description>
      <Type>SILVER</Type>
      <Hidden>false</Hidden>
    </Trophy>
    <Trophy>
      <Id>3</Id>
      <GameId>NPWR01320_00</GameId>
      <Title>Dirty Trick</Title>
      <Image>http://trophy01.np.community.playstation.net/trophy/np/NPWR01320_00_99AEBDAD64F168E03AAB052300041E4C358A654C/3212D02F61269BB4E7BB9724D7470D95FCFCFA67.PNG</Image>
      <Description>Defeat an enemy by throwing an object at him while he’s already down.</Description>
      <Type>BRONZE</Type>
      <Hidden>false</Hidden>
    </Trophy>
    <Trophy>
      <Id>4</Id>
      <GameId>NPWR01320_00</GameId>
      <Title>Invulnerable</Title>
      <Image>http://trophy01.np.community.playstation.net/trophy/np/NPWR01320_00_99AEBDAD64F168E03AAB052300041E4C358A654C/7F7DA25A92C489AA305E802627EF2C56E66681B8.PNG</Image>
      <Description>Play through a World and reach the boss without getting hit.</Description>
      <Type>SILVER</Type>
      <Hidden>false</Hidden>
    </Trophy>
    <Trophy>
      <Id>5</Id>
      <GameId>NPWR01320_00</GameId>
      <Title>Get The Girl</Title>
      <Image>http://trophy01.np.community.playstation.net/trophy/np/NPWR01320_00_99AEBDAD64F168E03AAB052300041E4C358A654C/601B220B8B7A6C17898E0B64B31CD121544ACA33.PNG</Image>
      <Description>Clear the game once with Scott.</Description>
      <Type>GOLD</Type>
      <Hidden>false</Hidden>
    </Trophy>
    <Trophy>
      <Id>6</Id>
      <GameId>NPWR01320_00</GameId>
      <Title>The Power Of Friendship</Title>
      <Image>http://trophy01.np.community.playstation.net/trophy/np/NPWR01320_00_99AEBDAD64F168E03AAB052300041E4C358A654C/3F319F5426404C6469C84D57B1F7B9B0ECD2A29A.PNG</Image>
      <Description>In a multiplayer game, reanimate another player at least 25 times.</Description>
      <Type>BRONZE</Type>
      <Hidden>false</Hidden>
    </Trophy>
    <Trophy>
      <Id>7</Id>
      <GameId>NPWR01320_00</GameId>
      <Title>Gourmet</Title>
      <Image>http://trophy01.np.community.playstation.net/trophy/np/NPWR01320_00_99AEBDAD64F168E03AAB052300041E4C358A654C/29C747FDCB682A00F286F928E9A6B6B3561E1CBB.PNG</Image>
      <Description>Eat every food items.</Description>
      <Type>BRONZE</Type>
      <Hidden>false</Hidden>
    </Trophy>
    <Trophy>
      <Id>8</Id>
      <GameId>NPWR01320_00</GameId>
      <Title>Vigilante</Title>
      <Image>http://trophy01.np.community.playstation.net/trophy/np/NPWR01320_00_99AEBDAD64F168E03AAB052300041E4C358A654C/8712224C85789AF720C08D1D2594C474A85F7331.PNG</Image>
      <Description>Defeat 1000 enemies.</Description>
      <Type>SILVER</Type>
      <Hidden>false</Hidden>
    </Trophy>
    <Trophy>
      <Id>9</Id>
      <GameId>NPWR01320_00</GameId>
      <Title>One Man Army</Title>
      <Image>http://trophy01.np.community.playstation.net/trophy/np/NPWR01320_00_99AEBDAD64F168E03AAB052300041E4C358A654C/CD5E2F13F8BB551255C50DA0282E157BF8440EFE.PNG</Image>
      <Description>Clear the game in single player on the “Supreme Master” difficulty setting.</Description>
      <Type>SILVER</Type>
      <Hidden>false</Hidden>
    </Trophy>
    <Trophy>
      <Id>10</Id>
      <GameId>NPWR01320_00</GameId>
      <Title>Shopaholic</Title>
      <Image>http://trophy01.np.community.playstation.net/trophy/np/NPWR01320_00_99AEBDAD64F168E03AAB052300041E4C358A654C/AFEBBCCF76B006DA3E255CACEA8F2F31F0E8BC1D.PNG</Image>
      <Description>Buy all the items of a shop during the same visit.</Description>
      <Type>BRONZE</Type>
      <Hidden>false</Hidden>
    </Trophy>
    <Trophy>
      <Id>11</Id>
      <GameId>NPWR01320_00</GameId>
      <Title>Armed And Dangerous</Title>
      <Image>http://trophy01.np.community.playstation.net/trophy/np/NPWR01320_00_99AEBDAD64F168E03AAB052300041E4C358A654C/2B4C74B031E63C6C126EFE7C4656032196656862.PNG</Image>
      <Description>Defeat at least 200 enemies using interactive objects.</Description>
      <Type>BRONZE</Type>
      <Hidden>false</Hidden>
    </Trophy>
    <Trophy>
      <Id>12</Id>
      <GameId>NPWR01320_00</GameId>
      <Title>“Chaudown”</Title>
      <Image>http://trophy01.np.community.playstation.net/trophy/np/NPWR01320_00_99AEBDAD64F168E03AAB052300041E4C358A654C/A330F924EFCFED8F0B86C22312ECBFAA2FC52F99.PNG</Image>
      <Description>Unlock and call all strikers.</Description>
      <Type>BRONZE</Type>
      <Hidden>false</Hidden>
    </Trophy>
    <Trophy>
      <Id>13</Id>
      <GameId>NPWR01320_00</GameId>
      <Title>It’s All In The Reflexes</Title>
      <Image>http://trophy01.np.community.playstation.net/trophy/np/NPWR01320_00_99AEBDAD64F168E03AAB052300041E4C358A654C/C12CC26EF080790AACAB4255A8CEE7590EADFD9B.PNG</Image>
      <Description>Catch a flying object at least 25 times with Knives.</Description>
      <Type>BRONZE</Type>
      <Hidden>false</Hidden>
    </Trophy>
    <Trophy>
      <Id>14</Id>
      <GameId>NPWR01320_00</GameId>
      <Title>Speed Run</Title>
      <Image>http://trophy01.np.community.playstation.net/trophy/np/NPWR01320_00_99AEBDAD64F168E03AAB052300041E4C358A654C/2CA55E59EB5DA912B1A61103B1ECD3CA0C5F8B95.PNG</Image>
      <Description>Clear the game in 90 minutes or less with Knives.</Description>
      <Type>SILVER</Type>
      <Hidden>false</Hidden>
    </Trophy>
    <Trophy>
      <Id>15</Id>
      <GameId>NPWR01320_00</GameId>
      <Title>Ninja Somersault</Title>
      <Image>http://trophy01.np.community.playstation.net/trophy/np/NPWR01320_00_99AEBDAD64F168E03AAB052300041E4C358A654C/E6EE45889D57FE32582C63BF1C1C48FF6A4CDEE4.PNG</Image>
      <Description>Perform at least 10 consecutive head stomps successfully with Knives.</Description>
      <Type>GOLD</Type>
      <Hidden>false</Hidden>
    </Trophy>
    <Trophy>
      <Id>16</Id>
      <GameId>NPWR01320_00</GameId>
      <Title>Wallace the novice!</Title>
      <Image>http://trophy01.np.community.playstation.net/trophy/np/NPWR01320_00_016D1DF1690A1AC3CBE4E1C355E3DC554A173FAA31/F4B617B316C2210D86D16BB69B8AC8990A96B302.PNG</Image>
      <Description>Completed your first online match with Scott Pilgrim Online Multiplayer and Wallace pack</Description>
      <Type>BRONZE</Type>
      <Hidden>false</Hidden>
    </Trophy>
    <Trophy>
      <Id>17</Id>
      <GameId>NPWR01320_00</GameId>
      <Title>Everybody wants to play</Title>
      <Image>http://trophy01.np.community.playstation.net/trophy/np/NPWR01320_00_016D1DF1690A1AC3CBE4E1C355E3DC554A173FAA31/07BA75715F7D9E9329A1877157BEE542C352E7A4.PNG</Image>
      <Description>Played Online with all characters at least once (including Wallace Wells)</Description>
      <Type>BRONZE</Type>
      <Hidden>false</Hidden>
    </Trophy>
    <Trophy>
      <Id>18</Id>
      <GameId>NPWR01320_00</GameId>
      <Title>And… It’s a Wrap!</Title>
      <Image>http://trophy01.np.community.playstation.net/trophy/np/NPWR01320_00_016D1DF1690A1AC3CBE4E1C355E3DC554A173FAA31/9CC2DF73E1B9EF81D7AFEA4986F2EB4807CA9658.PNG</Image>
      <Description>Clear the game once with Wallace Wells</Description>
      <Type>BRONZE</Type>
      <Hidden>false</Hidden>
    </Trophy>
    <Trophy>
      <Id>19</Id>
      <GameId>NPWR01320_00</GameId>
      <Title>Wallaciraptor!</Title>
      <Image>http://trophy01.np.community.playstation.net/trophy/np/NPWR01320_00_016D1DF1690A1AC3CBE4E1C355E3DC554A173FAA31/2A6701B2115854420BB75207420DA1929B5F8888.PNG</Image>
      <Description>Knockout 200 enemies in online mode with Scott Pilgrim Online Multiplayer and Wallace pack</Description>
      <Type>SILVER</Type>
      <Hidden>false</Hidden>
    </Trophy>
  </Trophies>
</PlayStationGame>