<?xml version="1.0" encoding="UTF-8"?>
<PlayStationGame xmlns:xsi="http://www.w3.org/2001/XMLSchema-instance" xsi:noNamespaceSchemaLocation="../PlayStationGame.xsd">
  <Game>
    <Id>NPWR00542_00</Id>
    <IdEurope/>
    <Title>Flower</Title>
    <Image>http://trophy01.np.community.playstation.net/trophy/np/NPWR00542_00_CA7A4EA9068CA36F4AA49810B27B889D503CDB0B/E2F2D3A0C9F0E1F4A987BA182CAE002321C4DFB8.PNG</Image>
    <TrophiesCount Total="14" Bronze="11" Silver="2" Gold="1" Platinum="0"/>
    <TotalPoints/>
    <Platform>ps3</Platform>
  </Game>
  <Trophies>
    <Trophy>
      <Id>1</Id>
      <GameId>NPWR00542_00</GameId>
      <Title>Dream</Title>
      <Image>http://trophy01.np.community.playstation.net/trophy/np/NPWR00542_00_CA7A4EA9068CA36F4AA49810B27B889D503CDB0B/60483DA63FFC638566139ACC33B7A62C450AE729.PNG</Image>
      <Description>Beyond all flowers lies another room.</Description>
      <Type>GOLD</Type>
      <Hidden/>
    </Trophy>
    <Trophy>
      <Id>2</Id>
      <GameId>NPWR00542_00</GameId>
      <Title>Nature</Title>
      <Image>http://trophy01.np.community.playstation.net/trophy/np/NPWR00542_00_CA7A4EA9068CA36F4AA49810B27B889D503CDB0B/DE9B4FDC9A0617BDD6B141C0D2FDA330E7A2E9C7.PNG</Image>
      <Description>Bloom 10,000 flowers.</Description>
      <Type>SILVER</Type>
      <Hidden/>
    </Trophy>
    <Trophy>
      <Id>3</Id>
      <GameId>NPWR00542_00</GameId>
      <Title>Urban</Title>
      <Image>http://trophy01.np.community.playstation.net/trophy/np/NPWR00542_00_CA7A4EA9068CA36F4AA49810B27B889D503CDB0B/470BEFC1BB53F19DFA6317ADC565452835D7E62C.PNG</Image>
      <Description>Completely awaken the city.</Description>
      <Type>SILVER</Type>
      <Hidden/>
    </Trophy>
    <Trophy>
      <Id>4</Id>
      <GameId>NPWR00542_00</GameId>
      <Title>Memories</Title>
      <Image>http://trophy01.np.community.playstation.net/trophy/np/NPWR00542_00_CA7A4EA9068CA36F4AA49810B27B889D503CDB0B/E205603A3A2E42949114E5982ADCBC16294FEA0B.PNG</Image>
      <Description>Reminisce for three minutes before returning to the room.</Description>
      <Type>BRONZE</Type>
      <Hidden/>
    </Trophy>
    <Trophy>
      <Id>5</Id>
      <GameId>NPWR00542_00</GameId>
      <Title>Palette</Title>
      <Image>http://trophy01.np.community.playstation.net/trophy/np/NPWR00542_00_CA7A4EA9068CA36F4AA49810B27B889D503CDB0B/621F41B996C40C06FD95150D3E527431A685E113.PNG</Image>
      <Description>Use the grass as your canvas and paint the ground with three different colors.</Description>
      <Type>BRONZE</Type>
      <Hidden/>
    </Trophy>
    <Trophy>
      <Id>6</Id>
      <GameId>NPWR00542_00</GameId>
      <Title>Wind</Title>
      <Image>http://trophy01.np.community.playstation.net/trophy/np/NPWR00542_00_CA7A4EA9068CA36F4AA49810B27B889D503CDB0B/276E91DF59E959707315F99890C2E09F52482461.PNG</Image>
      <Description>Play with the windmills and ride the wind seven times.</Description>
      <Type>BRONZE</Type>
      <Hidden/>
    </Trophy>
    <Trophy>
      <Id>7</Id>
      <GameId>NPWR00542_00</GameId>
      <Title>Illumination</Title>
      <Image>http://trophy01.np.community.playstation.net/trophy/np/NPWR00542_00_CA7A4EA9068CA36F4AA49810B27B889D503CDB0B/2CDD6F77E5B4CC5A695DE571A333D64BCF71CEFA.PNG</Image>
      <Description>Light a darkened pool.</Description>
      <Type>BRONZE</Type>
      <Hidden/>
    </Trophy>
    <Trophy>
      <Id>8</Id>
      <GameId>NPWR00542_00</GameId>
      <Title>Pure</Title>
      <Image>http://trophy01.np.community.playstation.net/trophy/np/NPWR00542_00_CA7A4EA9068CA36F4AA49810B27B889D503CDB0B/26B51B5328EC6126385E7A7A6C115AFD2BB65890.PNG</Image>
      <Description>Journey to the city unscathed.</Description>
      <Type>BRONZE</Type>
      <Hidden/>
    </Trophy>
    <Trophy>
      <Id>9</Id>
      <GameId>NPWR00542_00</GameId>
      <Title>Stars</Title>
      <Image>http://trophy01.np.community.playstation.net/trophy/np/NPWR00542_00_CA7A4EA9068CA36F4AA49810B27B889D503CDB0B/6BC722E8367ABB32EF4DDB4C10957A9E560F86C9.PNG</Image>
      <Description>Release all of the names to the sky.</Description>
      <Type>BRONZE</Type>
      <Hidden/>
    </Trophy>
    <Trophy>
      <Id>10</Id>
      <GameId>NPWR00542_00</GameId>
      <Title>flOw</Title>
      <Image>http://trophy01.np.community.playstation.net/trophy/np/NPWR00542_00_CA7A4EA9068CA36F4AA49810B27B889D503CDB0B/9A26318DF6295A54EC3B0A5583B6DBCC1F40D582.PNG</Image>
      <Description>Life could be simple...</Description>
      <Type>BRONZE</Type>
      <Hidden/>
    </Trophy>
    <Trophy>
      <Id>11</Id>
      <GameId>NPWR00542_00</GameId>
      <Title>Welcome Back</Title>
      <Image>http://trophy01.np.community.playstation.net/trophy/np/NPWR00542_00_CA7A4EA9068CA36F4AA49810B27B889D503CDB0B/41D8489191A900F1F25A1FF48A7A2FCD55113DF3.PNG</Image>
      <Description>Play the game after a week long break.</Description>
      <Type>BRONZE</Type>
      <Hidden/>
    </Trophy>
    <Trophy>
      <Id>12</Id>
      <GameId>NPWR00542_00</GameId>
      <Title>Healthy Play</Title>
      <Image>http://trophy01.np.community.playstation.net/trophy/np/NPWR00542_00_CA7A4EA9068CA36F4AA49810B27B889D503CDB0B/FC424AE5901C220DAE31862D80A4B994D8CAB50E.PNG</Image>
      <Description>Take a ten minute break between any dreams.</Description>
      <Type>BRONZE</Type>
      <Hidden/>
    </Trophy>
    <Trophy>
      <Id>13</Id>
      <GameId>NPWR00542_00</GameId>
      <Title>Beginning</Title>
      <Image>http://trophy01.np.community.playstation.net/trophy/np/NPWR00542_00_CA7A4EA9068CA36F4AA49810B27B889D503CDB0B/B9FE3F988FF281AF651C4FD48A0E70A1DEF8D29F.PNG</Image>
      <Description>The dream has just started...</Description>
      <Type>BRONZE</Type>
      <Hidden/>
    </Trophy>
    <Trophy>
      <Id>14</Id>
      <GameId>NPWR00542_00</GameId>
      <Title>Discovery</Title>
      <Image>http://trophy01.np.community.playstation.net/trophy/np/NPWR00542_00_CA7A4EA9068CA36F4AA49810B27B889D503CDB0B/F7750FD77567D4875EC2716A6BC7984AF75D40F8.PNG</Image>
      <Description>Find and bloom a secret flower.</Description>
      <Type>BRONZE</Type>
      <Hidden/>
    </Trophy>
  </Trophies>
</PlayStationGame>
